{
  "paper_id": "paper_007",
  "title": "Quality Minus Junk",
  "authors": "Asness, Clifford S.; Frazzini, Andrea; Pedersen, Lasse Heje",
  "year": 2019,
  "journal": "Review of Accounting Studies",
  "volume": "24",
  "issue": "1",
  "pages": "34-112",
  "doi": "10.1007/s11142-018-9470-2",
  "arxiv_id": null,
  "ssrn_id": "2312432",
  "bibtex": "@article{asness2019quality,\n  title={Quality minus junk},\n  author={Asness, Clifford S and Frazzini, Andrea and Pedersen, Lasse Heje},\n  journal={Review of Accounting Studies},\n  volume={24},\n  number={1},\n  pages={34--112},\n  year={2019},\n  publisher={Springer}\n}",
  "market": "Global",
  "asset_class": "Equity",
  "abstract": "We define a quality security as one that is safe, profitable, growing, and well managed. High-quality stocks outperform low-quality stocks on a risk-adjusted basis globally.",
  "conclusion_sign": "positive",
  "replicable": "yes",
  "notes": "Introduced a comprehensive quality factor (QMJ) combining profitability, growth, safety, and payout characteristics."
}
